{
  "build": {
    "compiler": "gcc",
    "defines": [
      {
        "name": "MLKEM_K",
        "value": "3"
      }
    ],
    "extra_args": [],
    "forced_includes": [],
    "include_dirs": [
      "include"
    ],
    "language_standard": "c90",
    "mode": "explicit",
    "undefines": [],
    "working_directory": "."
  },
  "options": {
    "excerpt_context_lines": 4,
    "max_items_per_category": 500,
    "preprocess": true,
    "preprocess_required": true,
    "preprocess_timeout_seconds": 30
  },
  "request_id": "fixture-valid",
  "schema_version": "1.0",
  "scope": {
    "exclude_globs": [],
    "source_files": [
      "include/poly.h",
      "src/poly.c",
      "src/use_poly.c"
    ]
  },
  "target": {
    "source_file": "src/poly.c",
    "symbol": "mlk_poly_sub"
  }
}
